{
  "$schema": "https://json-schema.org/draft/2020-12/schema",
  "title": "CloudSweep Report Polish",
  "type": "object",
  "required": ["schema_version", "run_id", "executive_summary"],
  "properties": {
    "schema_version": { "type": "string", "const": "1.0" },
    "run_id": { "type": "string", "minLength": 1 },
    "executive_summary": { "type": "string" },
    "key_points": {
      "type": "array",
      "items": { "type": "string" }
    },
    "caveats": {
      "type": "array",
      "items": { "type": "string" }
    }
  },
  "additionalProperties": false
}
